{
  "version": "1.0",
  "tier_rule": "High-confidence: phrase implies the listed traits in essentially every realistic project where it appears (no plausible counterexample). Low-confidence: phrase implies the traits only some of the time (a realistic counter-project exists). Decision rule: if you can describe a project where the phrase appears but the trait does not apply, the entry is low-confidence. When in doubt, low-confidence.",
  "high_confidence": {
    "agentic code review": {
      "traits": [
        "uses-llm",
        "is-agentic",
        "generates-code"
      ],
      "confidence": "high",
      "notes": "Agentic code review — LLM driving the review loop, suggesting + applying changes."
    },
    "Anthropic": {
      "traits": [
        "uses-llm",
        "uses-thirdparty-api"
      ],
      "confidence": "high",
      "notes": "Mentioning the provider implies third-party + LLM."
    },
    "biometric identification": {
      "traits": [
        "is-eu-high-risk",
        "processes-pii"
      ],
      "confidence": "high",
      "notes": "EU AI Act Annex III(1) — biometric ID + categorisation of natural persons is high-risk."
    },
    "border control": {
      "traits": [
        "is-eu-high-risk"
      ],
      "confidence": "high",
      "notes": "EU AI Act Annex III(7) — migration, asylum, border control management is high-risk."
    },
    "chatbot": {
      "traits": [
        "uses-llm",
        "accepts-user-input"
      ],
      "confidence": "high",
      "notes": "Any LLM-backed conversational interface."
    },
    "Claude": {
      "traits": [
        "uses-llm",
        "uses-thirdparty-api"
      ],
      "confidence": "high",
      "notes": "Specific model name implies the provider."
    },
    "code assistant": {
      "traits": [
        "uses-llm",
        "generates-code"
      ],
      "confidence": "high",
      "notes": "Code completion or code-explanation tooling."
    },
    "coding agent": {
      "traits": [
        "uses-llm",
        "generates-code",
        "is-agentic"
      ],
      "confidence": "high",
      "notes": "Agent that reads and writes code (Cursor-style)."
    },
    "credit scoring": {
      "traits": [
        "is-eu-high-risk",
        "handles-financial",
        "influences-decisions"
      ],
      "confidence": "high",
      "notes": "EU AI Act Annex III(5)(b) — creditworthiness evaluation is high-risk (excluding fraud detection)."
    },
    "critical infrastructure": {
      "traits": [
        "is-eu-high-risk",
        "is-external"
      ],
      "confidence": "high",
      "notes": "EU AI Act Annex III(2) — critical infra management/operation is high-risk."
    },
    "document Q&A": {
      "traits": [
        "uses-llm",
        "uses-rag"
      ],
      "confidence": "high",
      "notes": "Q&A over a document corpus — implies retrieval-augmented LLM."
    },
    "email assistant": {
      "traits": [
        "uses-llm",
        "accepts-user-input",
        "processes-pii"
      ],
      "confidence": "high",
      "notes": "Email drafting/triage assistant — emails contain PII by default."
    },
    "enterprise search": {
      "traits": [
        "uses-llm",
        "uses-rag",
        "is-internal"
      ],
      "confidence": "high",
      "notes": "AI-powered search over internal documents — implies RAG over org corpus."
    },
    "EU AI Act": {
      "traits": [
        "jurisdiction-eu"
      ],
      "confidence": "high",
      "notes": "Explicit EU AI Act mention — system is in EU regulatory scope."
    },
    "European Union": {
      "traits": [
        "jurisdiction-eu"
      ],
      "confidence": "high",
      "notes": "Explicit EU jurisdiction mention."
    },
    "FedRAMP": {
      "traits": [
        "jurisdiction-us-regulated"
      ],
      "confidence": "high",
      "notes": "US federal cloud authorization — implies US regulated jurisdiction."
    },
    "fine-tune": {
      "traits": [
        "uses-finetuned"
      ],
      "confidence": "high",
      "notes": "Matches 'fine-tune', 'fine-tuned', 'fine-tuning'."
    },
    "function calling": {
      "traits": [
        "is-agentic",
        "uses-llm"
      ],
      "confidence": "high",
      "notes": "OpenAI/Anthropic function/tool calling — by definition agentic."
    },
    "GDPR": {
      "traits": [
        "jurisdiction-eu"
      ],
      "confidence": "high",
      "notes": "EU regulatory scope."
    },
    "GPT-4": {
      "traits": [
        "uses-llm",
        "uses-thirdparty-api"
      ],
      "confidence": "high",
      "notes": "Matches 'GPT-4', 'GPT-4o', 'GPT-4 Turbo' via substring."
    },
    "HIPAA": {
      "traits": [
        "handles-health",
        "jurisdiction-us-regulated"
      ],
      "confidence": "high",
      "notes": "Mentioning HIPAA implies health data + US regulated."
    },
    "hiring": {
      "traits": [
        "is-eu-high-risk",
        "influences-decisions",
        "processes-pii"
      ],
      "confidence": "high",
      "notes": "EU AI Act Annex III(4)(a) — recruitment/selection AI is high-risk."
    },
    "image generation": {
      "traits": [
        "uses-llm",
        "generates-content",
        "is-multimodal"
      ],
      "confidence": "high",
      "notes": "AI image generation — multimodal output, content-generation surface."
    },
    "internal coding assistant": {
      "traits": [
        "uses-llm",
        "generates-code",
        "is-internal"
      ],
      "confidence": "high",
      "notes": "Coding assistant for internal engineering — code-gen + internal scope."
    },
    "judicial decision": {
      "traits": [
        "is-eu-high-risk",
        "influences-decisions"
      ],
      "confidence": "high",
      "notes": "EU AI Act Annex III(8) — administration of justice AI is high-risk."
    },
    "law enforcement": {
      "traits": [
        "is-eu-high-risk"
      ],
      "confidence": "high",
      "notes": "EU AI Act Annex III(6) — law enforcement AI is high-risk (predictive policing, profiling)."
    },
    "OpenAI": {
      "traits": [
        "uses-llm",
        "uses-thirdparty-api"
      ],
      "confidence": "high",
      "notes": "Same pattern as Anthropic."
    },
    "PCI DSS": {
      "traits": [
        "handles-financial",
        "jurisdiction-us-regulated"
      ],
      "confidence": "high",
      "notes": "Payment Card Industry Data Security Standard — implies financial data + US regulated."
    },
    "RAG": {
      "traits": [
        "uses-rag",
        "uses-llm"
      ],
      "confidence": "high",
      "notes": "Retrieval-augmented generation. Spelled out in next entry."
    },
    "resume screening": {
      "traits": [
        "is-eu-high-risk",
        "influences-decisions",
        "processes-pii"
      ],
      "confidence": "high",
      "notes": "EU AI Act Annex III(4)(a) — application analysis/filtering AI is high-risk."
    },
    "retrieval-augmented generation": {
      "traits": [
        "uses-rag",
        "uses-llm"
      ],
      "confidence": "high",
      "notes": "Spelled-out form of RAG."
    },
    "SOC 2": {
      "traits": [
        "jurisdiction-us-regulated"
      ],
      "confidence": "high",
      "notes": "US service-org compliance framework — implies US regulated context."
    },
    "SQL assistant": {
      "traits": [
        "uses-llm",
        "generates-code"
      ],
      "confidence": "high",
      "notes": "NL-to-SQL or SQL assistant — generates SQL code from natural language."
    },
    "support ticket triage": {
      "traits": [
        "uses-llm",
        "accepts-user-input",
        "influences-decisions"
      ],
      "confidence": "high",
      "notes": "Triage AI for support tickets — routes/prioritizes user-submitted issues."
    },
    "tool calling": {
      "traits": [
        "is-agentic",
        "uses-llm"
      ],
      "confidence": "high",
      "notes": "Same concept as function calling."
    },
    "vector database": {
      "traits": [
        "uses-rag"
      ],
      "confidence": "high",
      "notes": "Pinecone/Weaviate/Chroma/pgvector — any of these implies RAG."
    }
  },
  "low_confidence": {
    "AI agent": {
      "traits": [
        "is-agentic"
      ],
      "confidence": "low",
      "confirmation_prompt": "You mentioned an AI agent. Does an LLM choose the next action at each step (decides which tool to call, when to stop), or is the flow scripted by your code with the LLM only doing per-step generation? (yes / no / unsure)",
      "notes": "'Agent' is overloaded marketing language. True agentic systems delegate the action loop to the LLM."
    },
    "analytics": {
      "traits": [
        "processes-pii"
      ],
      "confidence": "low",
      "confirmation_prompt": "You mentioned analytics. Are individual users identifiable in the data, or is it aggregated (counts, percentages, no per-user records)? (yes / no / unsure)",
      "notes": "Aggregate analytics avoids PII."
    },
    "checkout": {
      "traits": [
        "handles-financial"
      ],
      "confidence": "low",
      "confirmation_prompt": "You mentioned checkout. Does this code touch payment processing, transaction records, or money flow? (yes / no / unsure)",
      "notes": "Checkout UI vs payment backend are different things."
    },
    "content moderation": {
      "traits": [
        "influences-decisions",
        "accepts-user-input"
      ],
      "confidence": "low",
      "confirmation_prompt": "You mentioned content moderation. Does the AI's classification act on content directly (delete/hide), or does a human reviewer make the final call? (yes / no / unsure)",
      "notes": "Same as 'moderation' but explicit two-trait suggestion."
    },
    "customer support": {
      "traits": [
        "accepts-user-input",
        "is-external"
      ],
      "confidence": "low",